<?xml version="1.0" encoding="UTF-8"?>
<cifp xmlns:xsi="http://www.w3.org/2001/XMLSchema-instance" xsi:noNamespaceSchemaLocation="CIFP_XSD.xsd">
    <alumne id="1">
        <nom>Juan</nom>
        <llinatges>Pérez Ramos</llinatges>
        <data_naixement>2004-12-01</data_naixement>
        <correu>juan.perez@hotmail.com</correu>
        <data_matricula>2023-09-10</data_matricula>
        <curs><DAW/></curs>
    </alumne>
   <alumne id="2">
        <nom>Mario</nom>
        <llinatges>Conde López</llinatges>
        <data_naixement>2006-03-11</data_naixement>
        <telefon>675897294</telefon>
        <data_matricula>2025-09-09</data_matricula>
        <curs><DAW/></curs>
    </alumne>
	<alumne id="3">
        <nom>Maria</nom>
        <llinatges>Conde López</llinatges>
        <data_naixement>2006-03-11</data_naixement>
        <adreça>C/Mar Carib,4, 07610, Palma</adreça>
        <data_matricula>2025-09-09</data_matricula>
        <curs><ASIX/></curs>
    </alumne>
    <professor id="100">
        <nom>Marta</nom>
        <llinatges>García Vidal</llinatges>
        <data_incorporació>2015-02-20</data_incorporació>
        <departament><Informàtica/></departament>    
        <assignatura id_assignatura="501">
            <nom_assignatura cicle="DAW">Desarrollo Aplicaciones Web</nom_assignatura>
            <data_inici>2023-09-15</data_inici>
            </assignatura>
        <assignatura id_assignatura="502">
            <nom_assignatura cicle="ASIX">Seguridad Informática</nom_assignatura>
        </assignatura>
    </professor>
	  <professor id="101">
        <nom>Matilde</nom>
        <llinatges>Navascuez</llinatges>
        <data_incorporació>2025-02-20</data_incorporació>
        <departament><Informàtica/></departament>    
        <assignatura id_assignatura="503">
            <nom_assignatura cicle="DAM">Desarrollo de Aplicaciones Multiplataforma</nom_assignatura>
            <data_inici>2023-09-15</data_inici>
        </assignatura>
    </professor>
</cifp>